id,url,label,responseCode,text
861,http://ussagamemnon.iwarp.com/,3,200,transport uss agamemnon sign sign close fast easi close transport complet onboard uss agamemnon ncc transport activ pannel uss agamemnon william coast command fine ship command lancashir execut offic ship current flagship task forc bravo fleet prepar await adventur unknown type adventur mysteri thrill battl borg escort duti ambassador agamemnon 
573677,https://www.abg.net,0,200,intern financi servic alexand beard alexand beard touch menu listen prosper belief provid profession passion financ genuineli commit finest advic wealth manag discov employe benefit discov emigr discov locat locat unit kingdom ireland unit south africa unit kingdom discov usa discov south africa discov australia discov ireland discov step meet 
451139,https://appliedneuroscience.com,4,200,appli neurosci afford eeg analysi softwar appli neurosci clinic applic histori innov user download download download demo download download eeg biofeedback testimoni eeg format amplifi match librari workshop video recommend scientif educ link scientif articl locat provid studi testimoni channel surfac score score surfac cross frequenc cross frequenc hub spoke 
974359,https://www.superendo.com,4,200,superstit spring endodont patient login refer doctor login schedul appoint procedur patient refer doctor instruct review root canal smile superstit spring endodont root canal smile superstit spring endodont purpos creat root canal peopl smile entir dedic provid gentl care root innov strive profession friendli integr teamwork partnership patient refer offic 
573478,https://www.rbs.co.uk,0,200,royal bank scotland bank account mortgag loan save jump access jump person premier log log menu close close person premier person premier product product bank account bank account bank account everydai bank account reward bank account student bank account child teen bank account overdraft account manag bank account appli overdraft 
967846,https://www.dalecountyboe.org,1,200,login navig menu board manual calendar account report clever dept south highwai ozark phone navig menu teacher resourc depart board educ superintend career technic educ child nutrit program curriculum instruct feder program financ human resourc special educ school health servic technolog transport virtual school school district ariton school bridg academi 
971735,https://alaskacrabtour.com,6,200,alaskan crab fish tour bere sea crab fishermen tour leav review book tour galleri menu tour galleri cart tour galleri menu tour galleri cart ticket bring thrill alaskan crab fish unforgett journei aboard icon aleutian ballad access educ interact alaskan fish tour teach rich marin ecosystem realiti sea immers humor 
573818,https://www.rawlinsinsurance.co.uk,0,200,rawlin insur commerci insur specialist rawlin insur enquiri brown brown insur broker limit servic insur insur chariti insur histor vehicl insur motor insur person insur quot faq insur classic car insur insur jargon explain brown brown insur broker limit servic insur insur chariti insur histor vehicl insur motor insur person 
449576,https://www.lighthousecu.org,0,200,england trust credit union lighthous credit union discov impact locat membership lighthous credit union check save digit bank manag account secur payment deposit paycheck sign log check account lighthous check lighthous reward check save account lighthous save lighthous premium save share certif digit bank debit card credit card digit bank 
584008,https://www.trentstudents.org,1,200,nottingham trent student union menu navig logo mission truste board campu social media advertis access student puls exec guid student voic offic academ rep idea democraci review eat drink citi campu campu clifton campu lost properti opportun societi passion project advic advic servic intern student academ discrimin harass health wellb 
971638,https://www.stepintoalaska.com,6,200,juneau excurs tour gastineau guid compani juneau premier whale watch hike excurs brandon hauser hugh carei david brandon hauser brandon hauser brandon hauser brandon hauser grai menu cruis shore excurs alaska whale glacier rainforest trail whale watch mendenhal glacier photo safari discov alaska whale mendenhal glacier guid choic trail hike 
980057,https://sistercreekresort.com,6,200,sister creek resort lodg amen galleri book menu lodg amen galleri book escap sister creek resort breathtak view bull shoal lake enjoi seren getawai natur fish connect love enjoi tranquil adventur book escap sister creek resort sister creek resort offer panoram view beauti bull shoal lake peac promis land arkansa 
573335,https://www.robinsonslondon.com,0,200,north london account london info account servic corpor tax person tax properti tax startup profit improv chariti profit media industri account financi account servic corpor tax person tax properti tax startup profit improv chariti profit media industri account financi collabor account trust rise cost minimum improv profit reduc cost financ 
969966,https://alabamakaratecircuit.com,5,200,alabama karat circuit registr info form link akc schedul adult youth akc akc rule assign time updat divis menu alabama karat circuit cancel check announc subscrib akc tournament announc continu compet alabama karat circuit each those circuit circuit rate akc karat circuit famili atmospher code conduct goal alabama karat circuit 
463470,https://thesnakesoup.org,3,200,snake soup fortifi kojima good snake soup menu featur editori articl myth articl video archiv forum link affili wolf meta gear metal gear inform rss newcom guid metal gear saga dawn era newcom learn rope metal gear solid master collect seri switch myth flag orient core hall intent peopl claim 
462516,https://bridgemaniacs.blogspot.com,3,200,bridg maniac bridg maniac experi bridg bridg ethic defens plai tournament junior bridg note canap system rank colleg footbal colleg footbal popular subject visit asburi cfb rank predict voyag upcom event lesson tuesdai reno reno month manywai disappoint town atmospher trashi partner dai varieti plai plai emori honestli happi plai 
583136,https://www.tennisnuts.com,5,200,tenni badminton squash specialist store close partial compani tenni specialist base london standard deliveri pound eur usd tenni badminton squash other sport sale black fridai store custom servic compani account deliveri info return custom servic login tenni equip tenni racket tenni cloth tenni shoe tenni bag tenni ball tenni grip 
220,https://sportscafe.in/,5,200,follow late india sport report featur sport sport sport cricket footbal late sport footbal live live commentari live schedul fixtur match report cricket footbal tenni hockei sport sport live late cricket footbal badminton hockei tenni basketbal late cricket late footbal ipl footbal cricket origin review sport login account user login 
980904,https://www.legalmatch.com,0,200,lawyer attornei lawyer post lawyer lawyer explor explor choos legal categori famili employ bankruptci financ govern product servic foreclosur child dui dwi divorc probat contract properti other legal categori law librari law librari bankruptci law law civil law crimin law employ law famili law financ law govern law immigr law 
977616,https://maxwell-aesthetics.com,4,200,maxwel cosmet plastic surgeri bodi arm reduct bodi lift mommi thigh lift tummi tuck brow lift ear surgeri eyelid surgeri facelift fat inject laser skin resurfac neck lift breast breast augment breast implant exchang breast implant remov breast lift breast reduct surgeri center med spa laser treatment ag spot remov 
971254,https://gonorth-alaska.com,6,200,alaska book car rv rental rate updat check deutsch explor wild alaska yukon travel expert car rv rental rental vehicl rental special deal locat hour avail winter rental faq rv servic rv servic anchorag rv servic whitehors car rv sale road trip tour road trip itinerari train packag short packag 
462441,https://www.sfgo.club,3,200,sf club log meet sponsor membership dojo amen tournament program workshop calendar file share job resourc submit game class calcul tab navig menu item san francisco club club america club san francisco institut san francisco club thrive inclus social club dedic ancient game rich histori date club cornerston commun sf 
976544,https://www.azcabins.com,6,200,arizona cabin rental resort lodg cabin strawberri hill navig menu cabin cabin info bedroom queen twin bedroom queen wed event wed famili reunion corpor event church retreat payment activ attract dine event fish hike hunt mountain bike shop swim wildlif info rate cabin rate cabin special direct faq polici pet 
595094,https://www.contours.co.uk,6,200,walk holidai contour walk holidai guid walk holidai expert advic daili accommod luggag transfer contour book condit holidai walk holidai locat south england north england wale scotland holidai locat discov inspir england coast path type classic trail short walk break dog friendli stile walk daili mileag walk beginn guid loyalti 
584148,https://www.allfie.org.uk,1,200,allianc inclus educ outdat browser upgrad browser mobil menu campaign project tortur disabl peopl send review disabl black live matter coronaviru covid educ segreg inclus london apprenticeship build stronger voic inclus champion project voic project resourc further brief principl success sign manifesto membership donat fundrais allianc inclus educ form normal 
979229,https://www.the-angel.com,6,200,vote eureka spring ak bed breakfast hillsid avenu eureka spring phone direct gift polici rate breakfast wed event packag add on galleri cycl overlai master data cycl arriv dd departur dd guest angel rose hall bed breakfast diamond aaa rate bed breakfast eureka spring christian angel rose hall bed breakfast 
1471,https://mofosex.net/,2,200,porn tube hot sex video xxx movi categori hq porn porn video xxx movi video video cartoon teen ass thai korean cuckold amateur threesom chines pov view vintag domin uncensor orgi babe russian arab fantasi latina german roommat natur tit parti amateur teen orgasm amateur wife japanes anal cast nude 
449521,https://www.bangorfederal.com,0,200,bangor feder credit union footer download acrobat reader view pdf file close alert dialog close thanksgiv bangor feder credit union locat close thursdai thanksgiv mobil bank platform access extern atm build conveni bangor feder credit union toggl menu close person deposit check deposit rate health save monei market account save 
1431,https://www.sexvid.xxx/,2,200,xxx hd sex video porn tube movi porno english deutsch log sign network porn rat xxx video photo categori pornstar channel commun live sex log sign view video month obnoxiousli bimbo mommi dick month cash gui fuck curvi latina chick abandon garag selma sin horni school babe xxx nice head 
975517,https://www.bnelsondds.com,4,200,phoenix dentist dr bruce nelson dd unit request appoint patient form servic review patient info smile galleri dental insur payment patient form tab navig menu item patient review servic servic appoint patient form visit dr bruce nelson dr lakshmi lead dentist central phoenix dr nelson dedic deliv innov procedur goal 
584180,https://www.bsm.co.uk,1,200,bsm learn drive bsm drive school enabl learn drive drive lesson automat drive lesson intens drive cours refresh lesson femal drive instructor advanc drive cours pass guid drive theori guid practic drive learner driver insur instructor drive instructor train start franchis drive school franchis bsm partner partner lite solo car 
828,http://www.ionpool.net/arcade/irobot/anderson/,3,200,robot creat jeff anderson robot doubt imagin game roll door design dave theurer follow surrealist tempest bomb sell robot deep game catch public ey mention hard boot polygon graphic base arcad game commonplac robot releas follow robot manual game overview player interfac robot rebellion brother evil ey robot player enter 
451337,https://www.pcsgroupinc.ca,4,200,precis calibr servic calibr repair biomed engin equip mon peopl compani manufactur biomed equip metrolog equip custom intern agent author servic center standard societi requir version adob flash player precis calibr servic pc special calibr repair biomed engin equip metrolog measur equip premium qualiti premium price price secondari standard qualiti 
1436,https://www.pornhits.com/main/,2,200,porn video hd sex movi xxx tube video rate view porn categori pornstar porn site upload pure taboo black naughti america woodman cast skeet view categori hd brunett tit ass cock blond tattoo pov site matur black pure taboo woodman cast bang bu network black raw realiti king pornstar mia 
595219,https://www.hillofoaks.co.uk,6,200,hill oak caravan lodg park holidai lake windermer lake district hill oak caravan lodg park primari navig gift voucher book dog friendli holidai lake district holidai lake windermer lake district stai southern shore lake windermer tuck ancient woodland south eastern shore lake windermer hill oak lodg caravan park ideal base 
967790,https://www.tarrant.k12.al.us,1,200,tarrant citi school district select school select school tarrant school tarrant intermedi school tarrant elementari school sign tarrant citi school empow learner leader tomorrow district school close district overview school board superintend offic directori depart ada complianc safeti athlet child nutrit counsel student resourc curriculum instruct facil mainten feder program 
1421,https://porn-hub.live,2,200,porn hub xxx pornstar categori live porno tube sort flick pick audienc enjoy practic watch download lot hook step mom perfect girl fuck boi indian fuck famili sex teen sister hot wife rough hottest tight daddi slut mommi schoolgirl fuck strang sleep hotel desi anal flash tit sexi bitch mother 
971637,https://mmtoursofjuneau.com,6,200,tour juneau ak explor juneau tour tour blue bu glacier express juneau citi tour juneau highlight tour mendenhal glacier book explor juneau wonder tour gatewai adventur blue bu juneau tour provid fly juneau visit cruis port prefer method travel downtown juneau mendenhal glacier tour journei downtown juneau visit popular breach 
980050,https://www.mountainmemoriesbedandbreakfast.com,6,200,mountain memori bed breakfast mountain view arkansa highwai cutoff mountain reserv rate polici check avail wed gift certif mountain memori bed breakfast mountain arkansa mountain memori bed breakfast offer visitor mountain lake uniqu lodg view lake privat deck floor pet friendli comfort luxuri includ each guest conveni locat minut mountain 
971388,https://denaliparkhotel.com,6,200,park hotel offici motel hotel book activ polici book park hotel alaska adventur await book escap park hotel discov unparallel comfort natur beauti park hotel premier destin majest nation park alaska mile north nation park entranc allow conveni access attract shop dine option comfort cozi guest surround majest mountain spirit 
968631,https://www.dothanperio.com,4,200,dothan dothan menu servic meet dr pittman appoint request patient form schedul appoint dothan periodont implant oral health prioriti completeli commit dental health provid care achiev understand condit treatment option confid choic comfort prioriti understand dental procedur time anxieti rest assur provid care treatment learn beauti smile relationship meet doctor 
980064,https://www.ozarkcountryinn.com,6,200,ozark countri inn menu account book stai mulberri king magnolia king suit birch king chestnut queen hickori queen holli king suit ozark countri cottag polici pet polici direct login innkeep phone book book stai ozark mountain pet friendli ozark countri inn explor pet friendli art meet bedroom cottag perfect famili 
577235,https://www.craske.co.uk,0,200,patent attornei patent attornei visit vacanc term fee pai patent trade mark design eu mark eu design other ip inventor articl establish intellectu properti practic base south west england client falmouth london north counti durham specialist advic registr servic manufactur industri patent trade mark regist design local rate phone fax 
462877,https://sorcerer-rpg.com,3,200,sorcer sorcer rpg histori errata faq term condit rule question sorcer rpg histori errata faq menu term condit rule question sorcer realm enchant embodi essenc sorcer enter innoc maiden mere speck grand tapestri exist portray magic contemporari fantasi literatur overli benign wizard depict melanchol figur utter enigmat phrase ordinari individu 
137123,https://www.bat.org,3,200,download game player visitor log start plai creat charact download game client login forgot password base realm plai roam creat build own reach divers multi user exist mediev theme fantasi role plai game brought grown fascin last entertain matter hardcor merchant charact pure wanderlust util sophist graphic engin own imagin 
231520,https://www.dragongoserver.net,3,200,dragon server dragon server log login regist introduct faq doc statist dragon server feel regist plai game login guest password regist account forgot password dragon server version mon creat login host 
573369,https://alanwsimons.com,0,200,alan simon account bournemouth servic request consult alan simon charter account advisor hillview centr avenu bournemouth dorset tel protect social term condit servic request consult alan simon account bournemouth alan simon alan simon advis owner manag busi famili aspect account tax advic templat templat templat core brick child child ver 
975455,https://medtrans.net,4,200,medic transcript servic phone client login medic transcript easi mission statement servic medic transcript servic digit transcript servic transcript servic medic transcript radiolog report orthoped transcript servic rheumatolog transcript servic plastic surgeri transcript servic psycholog neuropsycholog transcript servic emr ehr transcript servic medic record transcript medic transcript report medic transcript 
984971,https://www.cft.org,1,200,union educ classifi profession navig union educ classifi profession develop profit associ menu option quick union leader local union resolut kei document commun partner disast relief fund histori job open childhood classifi commun colleg univers retir union benefit benefit aft program scholarship workplac right train curricula resourc librari organ choos 
970097,https://visitsitka.org,6,200,visit sitka visit sitka sitka librari photo galleri activ visit dine event special offer stai hotel inn bed breakfast lodg vacat rental camp rv park reserv servic special offer visitor info travel requir here transport privat travel weather frequent question marri marijuana law travel servic special offer map guid download 
462835,https://www.professortangent.org,3,200,nutrit mind logic brainteas curriculum game humor tangent controversi bug rug fair elect other select topic logic teaser curriculum game humor tangent controversi brows faster bug rug fair elect qualiti think nutrit mind opinion common sens nonsens explan excus mind head professor tangent decid skeptic inquiri brainteas game logic common 
971353,https://www.hitchuprv.com,6,200,hain hitch rv park hain hitch rv park direct book rate rule polici amen galleri photo galleri galleri local event link select hain hitch rv park season georg laura hoffman owner book hain hitch rv park stai beauti hain alaska locat north fame passag terminu spectacular hain highwai hain quieter 
967826,https://www.oppcityschools.com,1,200,login regist build futur navig menu handbook polici curriculum transpar parent board educ board board minut board board schedul central offic superintend directori district calendar employe tr rsa depart financ facil feder program child nutrit student servic health transport opp citi school foundat oc foundat oper penni educ excel covid 
969052,https://burkettinsurance.com,0,200,quot friendli servic auto insur person auto homeown umbrella flood boat specialti program apart build owner rental properti auto repair shop commerci build properti farm insur grade landscap gymnast fit center heat cool healthcar medic offic restaur truck insur owner auto liabil worker comp commerci properti custom servic faq payment 
977574,https://bodyfundamentals.com,4,200,tucson studio medit perfect health menu geneviev unexpect cure studio event servic servic mentorship perfect health medit health consult prais price polici bodi fundament well here sleep night natur wake feel rest reduc joint pain hike afternoon pain morn reduc overwhelm anxieti test medit mind tool readi feel stronger physic 
463062,https://www.retrobase.net,3,200,preserv choos compani gce mb nec classic game retro consol here check game detail banner releas date platform develop game genr overview love simplic nostalg beauti retro game arcad enjoi collect classic game genr action adventur arcad combat fight gambl maze puzzl race rpg shoot em shooter simul sport strategi 
463453,https://duke3d.tripod.com,3,200,duke duke duke fan duke stori download duke cheat code secret other file download duke rt file custom file duke faq link other duke duke camera offici duke sign duke view duke design maintain andrew joyc internet exchang andrew joyc disclaim duke realm own dedic endors game realm endors promot 
569306,https://www.lamertonswales.co.uk,0,200,swale swale swale choos servic servic pathwai design tender procur contract negoti project programm resuscit stakehold engag partnership servic process transform social market behaviour chang client touch choos servic client touch empow healthcar deliv commerci success learn award win commerci develop transform chang consult healthcar sector swale foundat built engag 
573688,https://dallasmartin.co.uk,0,200,dalla martin account compani doctor fd sole trader emploi kei achiev compani doctor fd sole trader emploi kei achiev dalla martin account bespok servic align client requir martin smith manag director dalla martin account expert provis manag account system specialist servic financi director coupl commerci nou add compani doctor compani 
584109,https://www.chalkface.com,1,200,project lesson plan worksheet assess cours photocopi master lesson plan worksheet sampl download electron paper format secondari educ list download checkout card list download checkout card term condit printabl list resourc subject product art assembl behaviour attend studi career citizenship comput ict cover lesson cross curricular design technolog drama english 
573386,https://www.evansaccountants.com,0,200,evan account account england account account account charter account achiev financi knowledg financi freedom secret success peopl evan account charter account empow owner financi knowledg financi freedom annual meet real data proactiv advic decis technolog combin smile aim save tax hassl servic design empow owner financi knowledg learn advisor regular 
573252,https://www.ksagroup.co.uk,0,200,compani rescu london wide firm insolv practition servic expert guid legal regulatori notic director creditor insolv servic expert guid legal regulatori notic client portal insolv practition insolv practition insolv practition pressur formal insolv mechan administr creditor voluntari liquid reduc person liabil compani director act insolv practition advis director secur lender 
573472,https://campbell-lutyens.com,0,200,campbel lutyen submit nav background advisori director senior advisor histori commun corpor respons accolad expertis fund placement secondari advisori capit advisori sustain invest advisori client client studi insight public event career campbel lutyen graduat programm submit nav toggl header background header background progress focus advic lead global independ privat market 
574855,https://www.listening-books.org.uk,4,200,listen book chariti sign user access increas font invert colour book brows book menu sign brows book term condit membership servic project celebr peopl annual review link testimoni educ school membership school duke edinburgh skill award sound learn book school nation grid learn suggest read download listen book club sign 
577263,https://www.barkerbrettell.co.uk,0,200,barker patent trade mark design barker peopl equal divers inclus servic patent trade mark design china ip audit ip valuat opposit appeal renew startup start ip valid profession sector aerospac automot comput softwar cosmet energi food drink medic univers swedish offic swedish resourc knowledg hub updat studi euro ip career 
968765,https://bearcreeklogcabins.com,6,200,bear creek log cabin bear creek log cabin step antiqu hand hewn log cabin rental toggl navig cabin cabin cabin cabin cabin iii cabin iv cabin jacei cabin lodg attract galleri direct polici bear creek log cabin cabin bedroom peopl comfort price info cabin bedroom peopl comfort price info cabin 
970896,https://www.lakeshoremotorinn.com,6,200,accommod anchorag lakeshor inn suit accommod anchorag ak lakeshor inn suit accommod facil locat galleri reason stai courtesi shuttl airport lake hood minut ted steven intern airport fishermen hunter conveni sloper quiet street lake hood lot freezer space cabl close lake hood air taxi oper park bike trail public beach 
974053,https://nauticalbeachfrontresort.com,6,200,lake havasu resort nautic beachfront resort resort histori resort amen resort pamper pet program hotel polici offer accommod suit resort activ water sport boat attract food drink turtl grill nake turtl beach bar wet bar beach bu coffe cove meet gather wed reunion gather meet space custom quot galleri menu 
573709,https://www.axa-im.co.uk,0,200,axa brows axa corpor corpor discov purpos valu vision pledg road learn axa career opportun explor core invest explor core invest learn invest capabl fix incom equiti multi asset institut solut explor altern invest explor altern invest learn invest capabl explor menu invest strategi invest strategi client access broad rang 
