id,url,label,responseCode,text
463602,https://cm4mac.tripod.com,3,200,combat mission mac combat mission mac construct touch fell touch combat mission lack os reopen os version develop combat mission overlord combat mission berlin barbarossa contact faq basi offici faq honor happi posit week portion archiv releas here contribut steve charl matt givin sign view 
970876,https://elderberrybb.com,6,200,elder berri primari menu skin calori dessert healthi smoothi diet plan food photographi softwar app healthi food elder berri elder berri food skin food perform casino lign game care yourself food peopl misconcept categori uncategor tag comment calori dessert curb sweet tooth beauti casino lign game candi real candi kill 
451330,https://www.handsmedical.com,4,200,qualiti repair refurbish surgic tabl tabl servic healthcar technolog manag studi repair tabl servic healthcar technolog manag studi repair surgic orthoped imag tabl save thousand surgic tabl rebuild servic rebuild surgeri tabl save hospit thousand quot tech here allegro insit imag tabl steward health save dollar rebuild replac surgeri tabl 
433777,https://www.archonstl.org,3,200,archon offici midwest premier scienc fiction fantasi archon bring fan door gatewai convent collinsvil illinoi usa door fri sat program guid game schedul regist lodg featur guest vendor panelist fun program activ youth grand masquerad game miniatur model hallwai costum contest parti art auction nightli danc board game librari fandom 
980388,https://www.visitwestarkansas.com,6,200,western arkansa mountain frontier plan trip event histori beauti adventur request visitor guid request guid view guid western arkansa mountain frontier lavish wineri inspir art destin picturesqu fish spot histor trail western arkansa mountain frontier special slice paradis travel nation forest park head numer blue shore fish kayak water sport 
971467,https://www.twincreekstrailhead.com,6,200,lodg homer alaska twin creek trailhead lodg retreat alaskan lodg retreat homer ak alaskan lodg overlook bai cook inlet ideal famili wed workshop custom own guid adventur tour yoga workshop twin creek trailhead lodg retreat nestl south slope diamond ridg feet seasid town homer alaska lodg build provid accommod guest 
975980,https://www.imortgage.com,0,200,join forc found premier retail purchas builder base mortgag bank compani provid vast arrai mortgag product help thousand famili enjoi secur join forc creat platform deliv incred current futur homeown learn cooki cooki term licens access access licens licens fair lend fair lend access access licens fair lend fair lend 
970939,https://www.ykhc.org,4,200,yukon kuskokwim health corpor strive healthiest peopl servic cost servic servic behavior health childhood vaccin commun health well dental alaska care offic environment health engin optometri pharmaci primari care travel manag villag clinic women pre matern health public health boil water notic healthi recip prevent care respiratori ill stori delta 
450178,https://merger.com,0,200,capit advisor capit advisor client login video advisori overview sale process pre sale plan sell famili corpor divestitur distress partial buyout advisori overview role advis buyer develop acquisit strategi financ deal bui distress fair opinion rais capit overview growth capit recapit mbo lbo acquisit financ industri expertis overview servic process 
971461,https://islandwatch.net,6,200,island watch vacat rental homer alaska island watch vacat rental homer alaska menu avail reserv spirit alaska memori here island watch vacat rental broad base home perfect base alaskan vacat choos spaciou home cozi cabin home view beauti bai glacier chugiak mountain local knowledg support base here homer answer question 
969384,https://www.whitesmilecentermobile.com,4,200,dentist mobil local dentist white smile locat locat mobil moss mobil moss patient servic view servic dental implant brace dental checkup dental crown dental bridg dental implant dental veneer dental lamin dentur partial dentur emerg dentist mouth reconstruct kid friendli dentist laser dentistri root canal treatment sedat dentist smile teeth 
969301,https://marineandindustrial.com,0,200,marin industri suppli wire rope rig coat suppli test industri outdat browser upgrad browser activ chrome frame improv login custom servic vendor product servic career custom satisfact survei marin industri menu vendor product servic career custom satisfact survei offshor marin industri commit provid safest qualiti equip offshor client learn offshor 
970691,https://www.alaskaalternativemedicine.com,4,200,alaska altern medicin clinic anchorag integr medicin servic nutrit iv therapi puls electromagnet field therapi ozon therapi ultraviolet blood irradi chelat therapi bio feedback bio ident hormon micronutri test health panel test condit autoimmun diseas thyroid yeast lyme diseas supplement supplement store hous doc store form resourc tab navig menu 
974489,https://www.circlez.com,6,200,dude ranch arizona circl ranch rest assur promis learn circl ranch arizona origin guest ranch primari menu lodg standard casa azteca queen casa rosa king adjoin casa azteca adjoin cottag adjoin suit suit suit casa azteca suit lucia suit cottag cottag cottag hill hous ground rate dine cookout buffet style 
973702,https://coppercanyondentalaz.com,4,200,copper canyon dental famili dentist gilbert moc meet dr mitchel dmd patient testimoni procedur clean prevent cosmet dentistri dental anxieti fear dental emerg endodont oral maxillofaci surgeri orthodont pediatr dentistri periodont diseas restor dentistri sedat dentistri patient patient form post op instruct financ option dental insur accept frequent question help 
262,https://www.completesports.com/,5,200,complet sport nigeria nigeria sport sport nigeria sport premier leagu footbal intern super eagl late nigeria nigeria cup sport nigeria sport premier leagu footbal intern super eagl late nigeria nigeria cup sport europa leagu knockout draw arsen unit tricki draw furi disappoint joshua win rule month ankl injuri updat ucl 
233,https://www.sportelo.com.ng/,5,200,stori slam red card gunner suffer shock loss burnlei arsen legend ian wright leicest challeng champion leagu spot return claim leagu goalkeep blunder crystal palac break dortmund sack heavi loss stuttgart real madrid real madrid stun leagu leader close gap editor pick slam red card gunner suffer shock loss burnlei 
967969,https://www.healthcarehof.org,4,200,alabama healthcar hall fame purpos board nomin honore honore honore honore honore honore honore honore honore honore honore honore honore honore honore honore honore ceremoni induct ceremoni induct ceremoni induct ceremoni induct ceremoni induct ceremoni induct ceremoni induct ceremoni induct ceremoni induct ceremoni friend support anchor alabama healthcar hall fame 
574741,https://hdc.co.uk,4,200,beauti hair design clinic phone queen parad queen road hendon london menu phone male hair loss surgic surgic femal hair loss femal hair replac laser therapi specialist treatment alopecia burn chemotherapi afro caribbean hair loss compuls hair pull enquir lead hair laser hair therapi lead central london clinic specialis effect 
577246,https://www.dehns.com,0,200,intellectu properti lawyer norwai germani histori data protect csr servic patent patent overview chemistri pharmaceut chemic engin softwar artifici intellig electron commun engin scienc biotechnolog physic scienc materi patent box trade mark trade mark overview trade mark search opposit enforc trade mark renew registr transact dilig trade mark file prosecut 
1457,https://tubegalore.tv/,2,200,porn tube xxx video categori hq porn porn movi sex tube video video public anal japanes uncensor amateur japanes wife voyeur saggi tit solo mom gangbang beauti french dirti talk homemad fist bbc ugli stock squirt dog teen shoplift escort german tattoo heel teen anal turkish african shy fantasi car 
248889,https://www.mickledore.co.uk,6,200,walk holidai travel arrow cart close logo logo logo colour logo menu print menu telephon connect english nederland unit canada australia walk holidai specialist ireland channel island independ custom feedback holidai northern england cleveland coast coast dale dale hadrian wall herriot ladi ann northumberland coast path pennin settl carlisl oswald 
449598,https://www.millstreamcu.com,0,200,millstream credit union findlai ohio bank servic login millstream credit union locat hour rout save save save save share save account kid club account monei market account certif individu retir account ira christma club account special save account servic servic account servic deposit rate close nav spend spend check check 
448477,https://www.coatestraining.com,1,200,coat train cours book cours book intro food industri train hospit educ nurseri children centr commun youth residenti social landlord care sector construct farm intro dai time suit touch detail paediatr aid come everton thursdai sat lune vallei sat liverpool sat offic phone train deliv food safeti health safeti cours 
804,http://www.rpg.net/news+reviews/reviews/rev_4588.html,3,200,review rpg game forum review column ap game rpg review edit edit review review overview word puzzl card game wizard coast packag standard doubl card pack card suitabl player ag adult plai minut profession simpli fit famili game pack rule game alpha blitz game variat common theme competitiveli word letter 
978934,https://winnamocka.com,6,200,camp adventur camp adventur primari menu health safeti summer camp frontier express camp info registr scholarship fun fill activ meet parent pack list faq employ parent portal rope special activ price guid retreat planner attract fort jackson wilder lodg blob slide pirat ship tropic pool fossil ridg blue lagoon fort 
289,https://www.qldcricket.com.au/,5,200,queensland cricket queensland cricket offici queensland cricket queensland bull queensland brisban heat talent pathwai involv pavilion queensland cricket wet tav final stream club heat premier spree brahman squad video umpir seri help tip umpir seri stakehold relationship umpir seri equip innov team queensland bull queensland brisban heat develop futur champion 
970299,https://sleepybearalaska.com,6,200,sleepi bear cabin llc cabin lodg cabin rental stai night night rate qualifi season detail cabin amen rate anchor amen anchor fish fish process bird cabin amen rate anchor amen anchor fish fish process bird cabin amen rate anchor amen anchor fish fish process bird perfect getawai perfect getawai perfect 
574251,https://www.ii.co.uk,0,200,interact investor flat fee invest platform log account servic isa stock share isa manag stock share isa junior isa transfer isa isa invest idea isa guid pension invest person pension sipp transfer pension trade account trade account joint trade account compani account transfer trade account other servic cash save start 
971836,https://innatternlake.com,6,200,inn tern lake moos pass alaska accommod activ wed reserv moos pass imag inn tern lake nestl kenai mountain tern lake inn tern lake alaska unequ excel enjoi accommod bed breakfast inn adjac tern lake heart kenai peninsula accommod uniqu bed breakfast inn featur each delux amen privat bath balconi 
573275,https://www.saint.co.uk,0,200,saint charter account tax advisor carlisl meet offic locat servic start financ move cloud insolv plan futur save tax save stai compliant account manag account payrol vat audit plan merger farm chariti academi tourism leisur hous bookkeep tax overview inherit tax trust estat capit gain tax person tax tax properti 
976001,https://azlegalcenter.com,0,200,phoenix arizona insur bad faith lawyer attornei arizona insur attornei claim lawyer scottsdal arizona law offic shane plc profession law corpor initi phone consult treat unfairli bad faith insur compani law firm offic scottsdal phoenix maricopa counti arizona tailor legal practic protect insur consum policyhold bad faith tactic insur compani 
573323,https://morriscook.co.uk,0,200,morri cook charter account llangollen llangollen protect portal login servic account prepar account softwar advic develop startup manag account payrol servic taxat servic train servic financi servic human resourc advic tax rate fix fee testimoni vacanc account grei rang servic success success establish firm charter account centuri success track record 
1401,http://www.freepornpasswordsforwomen.com/naked-studs/5index.html,2,200,porn pass word sex industri oop help australian phone sex live sex sex date xxx sex toi stripper australia gai sex date gai cam boi australian phone sex live sex sex date xxx sex toi stripper australia gai sex date gai cam boi australian phone sex live sex sex date 
573572,https://www.act.is,0,200,acti acti peopl media centr street view investor centr button transform infrastructur tomorrow view hong kong monetari author anchor acti asia climat strategi decarbonis asia atlant complet acti acquisit acti invest largest integr energi storag project philippin acti jv ampl park launch acquisit street view view insight hub featur profession 
971107,https://alaskachaletbb.com,6,200,alaska chalet bed breakfast accommod eagl river anchorag alaska suit reserv alaska link photo except spaciou suit price accommod garden suit unwind appoint ground suit featur privat entranc kitchenett patio enjoi morn coffe vacat rental alaska chalet suit enjoi spaciou comfort secur sq ft suit direct access wrap deck offer 
972492,https://www.travelalaska.com,6,200,offici alaska vacat travel alaska vacat planner alaska travel deal sustain tourism north alaska explor alaska explor alaska overview travel articl itinerari local tip mountain alaska nativ cultur glacier wildlif northern light alaska travel special imag deal packag overview adventur alaska nativ cultur cruis festiv event fish food entertain hike 
972258,https://healthquesttherapy.com,4,200,physic therapi occup therapi health quest therapi career health quest therapi health quest therapi commun event therapi locat conveni alaska clinic locat servic vari locat alaska eagl river alaska therapi servic therapi servic offer health quest therapi servic vari locat physic therapi hydrotherapi occup certifi hand therapi oncolog rehabilit therapi 
590398,https://www.hallfarmbb.co.uk,6,200,hall farm bed breakfast bed breakfast royston saffron walden hall farm bed breakfast beauti georgian farmhous hall farm bed breakfast hall hall lane royston hertfordshir mob toggl navig book galleri locat nearbi attract hall farm bed breakfast hall hall lane royston hertfordshir mail hall farm offer bed breakfast cater accommod 
573439,https://www.dataplanpayroll.co.uk,0,200,payrol provid payrol compani navig tel login quot choos provid secur custom care carbon posit pledg stan gang studi meet pa accredit servic manag payrol oversea payrol irish payrol jersei payrol elect payrol franchis payrol auto enrol portal gender pai gap report servic consult servic career sector educ hospit leisur 
970695,https://www.akoa.org,4,200,alaska optometr associ time login forgot password board director resourc event classifi ad optometri job open alaska alaska practic sale login board director resourc event classifi ad optometri job open alaska alaska practic sale hb sign law alaska optometr associ alaska optometr associ dedic improv enhanc vision care public health 
977743,https://discoverytreks.com,6,200,grand canyon tour yosemit backpack trip discoveri trek locat montana backpack tour summer sale save dome backpack tour code adventur upcom tour adventur log guid job locat redfield ste scottsdal hour sat sun adventur adventur adventur detail black fridai sale here tour sale sale premier adventur compani connect independ guid 
972216,https://lulubelletours.com,6,200,alaska glacier tour wildlif cruis whale watch alaska aboard enjoi glacier wildlif cruis valdez alaska aboard bell limousin princ william sound captain fred invit alaska wilder whale other wildlif princ william sound majest glacier valdez busi harbor terminu famou tran alaska oil pipe comfort luxuri aboard motor yacht bell alaska 
573810,https://www.coversure.co.uk,0,200,local insur broker start quot insur public liabil commerci combin tradesman employ liabil restaur caf offic hair salon beauti salon takeawai director offic profession indemn contractor risk pub liabil tool manufactur marin cargo secur care detail travel properti landlord commerci properti unoccupi properti holidai flood risk landlord rent guarante properti 
972333,https://www.cb300.com,5,200,copper basin menu close menu race race registr race rule volunt race rout descript musher live checkpoint time start time time lake time sourdough time lake louis time time finish time race histori checkpoint time checkpoint time checkpoint time sponsorship sponsor sponsor mile store board director race race registr race 
584192,https://driving4tomorrow.com,1,200,advanc drive chri gilbert polic instructor tel sale dri orrow advanc drive drive dai advanc drive dai demo skill commentari drive review custom review drive review chri gilbert advanc drive defens drive learn skill polic advanc driver chri gilbert specialist advanc drive instructor cover mile teach polic offic advanc pursuit 
583124,https://www.footballprogrammes.com,5,200,collector footbal programm soccer select aldershot arsen barnslei barrow blackpool bolton bournemouth brentford brighton burnlei buri celtic charlton chelsea chester chesterfield colchest coventri darlington derbi everton exet fulham gillingham grimsbi hartlepool hereford huddersfield hull liverpool mansfield middlesbrough northampton oldham peterborough portsmouth preston ranger read rochdal rotherham sheff wed southampton southport 
971484,https://juneberrylodge.com,6,200,juneberri lodg homer alaska bed breakfast ju ber lodg direct reserv juneberri lodg bed breakfast homer alaska perfect getawai homer vacat featur stun glacier bai view beauti natur abuzz wildlif captiv view delici food juneberri lodg homer alaska bed breakfast juneberri lodg rustic log bed breakfast homer alaska enjoi spectacular 
573705,https://accountsco.co.uk,0,200,credenti servic account tax complianc person tax advic payrol audit assur start servic custom regul procedur legal visa immigr recruit sale commercialis softwar reloc network club ceo club angel investor club entrepreneur club partner employe resourc button credenti servic account tax complianc person tax advic payrol audit assur start servic 
1005234,https://www.swtor.com,3,200,star war republ subscrib account plai store commun media game overview game set digit expans game updat legaci game event galact histori class companion crew skill stori mission mission competit galact command guild person legaci stronghold allegi creatur humanoid oper planet space combat account patch note server statu alert redeem 
972845,https://azsba.org,1,200,arizona school board associ login directori servic resourc advocaci event commun award servic resourc advocaci event commun award select commun commun ensur excel govern arizona public school arizona school board associ privat profit partisan organ cultiv excel local govern school district bring school arizona commun resourc advocaci event equiti happen 
584007,https://www.napierstudents.com,1,200,admin edit account user log navig log bar sponsor sister board director locat space public constitut advic advic servic overview book appoint disabl educ advic contact welfar issu wellb card safe sex gambl awar mental health sport sport club engag fit sport kit fixtur trimest join club bank societi societi 
574854,https://www.optimalowvision.co.uk,4,200,optima vision menu access guid catalogu event expert advic train optima vision servic premier distributor vision aid suppli comprehens rang optic electron magnifi largest rang anti glare filter europ increas rang led task lamp here current catalogu notic here updat oper guidelin clean disinfect acryl lens basket item total view 
79280,https://www.bridgebase.com,3,200,bridg base plai bridg current watch schedul archiv hand record dollar login regist current watch schedul archiv hand record dollar login regist bridg base unlimit bridg social plai acbl game tournament solitair player tabl plai bridg game anonym plai bridg infinit stream hand plai bridg set deal plai declar bid 
835,http://www.mopinball.com/,3,200,pinbal machin sell repair pinbal machin mexico missouri limit ship owner pinbal machin galleri pinbal machin mexico missouri pinbal machin missouri pinbal pin local mid game machin restor owner owner pictur balli william shadow sorcer paragon tomcat taxi superman galaxi black knight corvett getawai clean set format pictur galleri sale 
780,http://boardgamegeek.com/boardgame/369/5ive-straight,3,200,straight board game card plai limit marker row win board game board game game hobbi geek 
970751,https://www.hartmanorthodontics.com,4,200,hartman orthodont orthodontist anchorag ak anchorag patient login meet dr brian hartman meet patient offic visit patient form orthodont testimoni financi brush floss type brace ligat brace type applianc retain instruct emerg care orthodont orthodont orthodont treatment ag surgic orthodont digit impress cat imag info teen info cost testimoni video 
968475,https://www.treasureislandbedandbreakfast.com,6,200,treasur island bed breakfast treasur island bed breakfast menu alabama guid eat entertain hike outdoor activ bed breakfast menu close close menu alabama guid menu data toggl type data toggl durat aria expand menu eat entertain hike outdoor activ menu data toggl type data toggl durat aria expand menu bed 
972473,https://www.royalcoachmanlodge.com,6,200,alaska royal coachman lodg alaska fly fish trip remot alaska lodg fly fish trip salmon trout fish arsen river lake speci fish fish option imagin decid fish pound pike surfac fresh sea lice cover salmon coast hike creek arctic char mountain lake stream rainbow dolli mix bag grayl lake trout 
978661,https://www.cabotschools.org,1,200,cabot public school schedul tour school school choic explor cp directori cabot school board boundari zone cabot panther foundat cabot public school militari famili dyslexia safeti crisi resourc stand bulli teenag hard depress awar school central elementari eastsid elementari mag creek elementari mountain spring elementari elementari elementari stagecoach elementari ward 
462870,https://www.galileogames.com,3,200,galileo game game stuff download sign subscrib compani templat booklet design facilit dialogu connect peopl hard time space critic convers intim close relationship creat structur mind space engag boundari galileo game galileo game galileo game galileo game galileo game optimist guid tarot galileo game galileo game curvi roller jam galileo 
976195,https://hopepharm.com,4,200,hope pharmaceut cyanid antidot approv fda sodium nitrit sodium thiosulf count treat threaten cyanid poison fda approv cyanid antidot individu packag medic sodium nitrit inject usp view sodium thiosulf inject usp view each sodium nitrit inject usp view reg kit view sodium thiosulf inject usp view intend inform purpos intend 
969396,https://harveyandthomasortho.com,4,200,orthodont offic mobil harvei thoma orthodont payment calcul patient form refer patient consult practic meet doctor meet technolog patient review orthodont brace type brace brace kid brace teen brace adult brace kid teen adult faq benefit faq other treatment treatment phase treatment patient resourc visit patient form financi refer patient 
281,https://www.beforeyoubet.com.au/,5,200,sport bet tip australian review bet bet australian sport bet promot review australian sport bet sport bet race australian sport bet sport bet bookmak review tip articl sport bet sport bet tip bet sport bet tip review jump navig sport bet tip cricket tip bash leagu tip nfl tip epl 
972023,https://www.sewardhotel.com,6,200,seward hotel inn seward hotel seward ak book check check reserv amen attract locat except seward alaska inn seward hotel offer fashion alaskan hospit spectacular locat breathtak view mountain conveni locat heart seward ak inn ideal accommod choic visit pride ourselv provid relax set amen person touch servic dai lodg 
984962,https://www.creec.org,1,200,network statewid project region region overview region region region region region region region region region region region previou california region environment educ commun network program california depart educ network foster region partnership california promot environment educ environment literaci provid teacher access qualiti profession learn opportun educ resourc statewid sponsor partner 
973346,https://aquiladental.com,4,200,aquila dental chandler serv commun aquila dental price ste chandler unit offic meet doctor meet servic cosmet specialti dentistri overview cosmet dentistri prosthodont teeth whiten mouth reconstruct smile porcelain veneer dental implant dental implant dentur partial singl tooth implant align implant support dentur inlai comprehens dental servic dental emerg treatment 
573845,https://www.lloydwhyte.com,0,200,lloyd whyte specialist insur healthcar profession healthcar profession advic quot career healthcar profession insur servic insur servic time link person insur servic document commun broke person insur motor insur travel insur residenti properti owner insur health wellb privat client insur servic thatch list insur commerci commerci properti owner insur insur 
732861,https://www.fiendishsudoku.com,3,200,fiendish fiendish easi learn digit each cell row column box should each digit fiendish post puzzl each puzzl uniqu solut solv pure logic guess requir learn archiv thousand grade puzzl puzzl design creat hand archiv deutsch ol fran ai nederland friend feedback commerci enquiri print abl currenc usd cad pound 
