id,url,label,responseCode,text
971646,https://www.alaskansunset.com,6,200,alaskan sunset cabin cabin book cabin polici tab navig menu item alaskan sunset cabin locat kasilof alaska kenai cabin sit bluff overlook cook inlet west provid stun view alaska rang sunset view kenai finest alaska lodg kenai peninsula each cabin rental maintain goal provid excel lodg servic view unmatch properti 
573622,https://www.realbusinessrescue.co.uk,0,200,real rescu licens insolv practition insolv solut face creditor pressur advic requir director close compani compani insolv compani insolv unabl pai debt dissolv compani strike advic strike compani dissolv compani hous licens insolv practition licens insolv practition outlin option liquid creditor voluntari liquid voluntari liquid process insolv compani voluntari liquid 
977700,https://sentinelpeakrv.com,6,200,sentinel peak downtown rv park tucson facil attract photo galleri rate park direct select sentinel peak rv park welcom downtown tucson arizona rv park hook site book rig friendli tucson arizona rv park love sentinel peak rv park downtown rv park tucson arizona relax pool read book rv awn visit 
787,http://www.chesspals.com/,3,200,worcest chess club meet thursdai worcest hibernian cultur centr templ street worcest chess chess club worcest chess club worcest chess tournament tournament chess chess massachusett scholast chess studi chess studi chess tournament donna presid phone alonzo ross tournament director phone rawl rutter tournament director phone club locat templ worcest mail 
967740,https://www.marengo.k12.al.us,1,200,login navig menu marengo school district directori calendar school board superintend school board central offic depart financ employe servic invit bid feder program career technic educ gear alabama child nutrit curriculum instruct alabama literaci alabama numeraci district bid propos human resourc personnel polici special program report superintend technolog virtual realiti 
981441,https://dgcattorneys.com,0,200,california worker compens defens firm dietz worker compens attornei att central mail milliken av suit box rancho servic firm servic attornei san diego corpor offic ontario inland empir lo angel san francisco bai beach sacramento santa monica orang counti fresno central california covid resourc express referr firm servic attornei san 
584070,https://www.portage.org.uk,1,200,nation portag associ portag hub portag midland north south train develop train opportun portag workshop npa train trainer continu profession develop award npa core compet portag curriculum modul upcom cours event event train calendar npa stamp approv scheme servic registr npa trainer npa accredit trainer studi studi portag parent studi 
577272,https://www.reddie.co.uk,0,200,intellectu properti law intellectu properti law grose firm respons career peopl capabl servic patent trade mark unifi patent court design plant varieti start sector advanc engin biotechnolog pharmaceut brand design chemistri materi energi comput softwar consum product manufactur electron electr devic financi servic method medic devic digit healthcar telecommun broadcast 
450208,https://www.newhorizon.org,0,200,loan equip leas startup leas sale leaseback factor merchant cash advanc capit purchas loan sba loan consum loan credit card bad credit card credit card secur credit card soft inquiri credit card catalog credit card student credit card credit rebuild credit card loan auto loan person loan debt consolid credit 
968868,https://watervilleusa.com,6,200,park watervil usa amus park gulf shore park attract attract amus park attract plan visit ticket park hour date park edward acr pure fun watervil usa offer acr fun amus park escap locat mile beach heart beauti resort commun gulf shore alabama invest improv attract park memori watervil usa commit 
582680,https://www.modelenthusiasts.com,5,200,steam engin guru cart sign regist send eu countri menu expert spare drive band rivet fuel brass tube fuel drive band rivet cart checkout requir properli enabl browser categori expert spare drive band rivet fuel brass tube spare here spare help hand imagin have season engin speed dial readi troubleshoot 
462504,https://www.bridgebum.com,3,200,bridg bid convent plai bid convent convent categori bid principl bid system declar plai defens articl player refer famou bridg player histori bridg rule plai ethic etiquett link bridg convent updat deng deng renown chines leader steer china era reform modern polit mastermind devot bridg player principl restrict choic principl 
574830,https://www.uk-wheelchairs.co.uk,4,200,wheelchair qualiti wheelchair price disabl browser enabl browser util function account basket checkout log hour mon fri sat sun basket item shop basket wheelchair qualiti deliveri wheelchair electr propel transit model price match promis propel transit wheelchair transport heavi duti electr wheelchair walk aid reclin accessori commit offer class servic 
923360,https://www.coasthotels.com,6,200,coast hotel uniqu network hotel canada usa gift card gift card benefit sign menu dashboard profil transact reserv offer redeem sign stai deal plan meet meet promot coast event assur coast reward meet planner request space stori meet franchis opportun pet friendli refreshingli green coast clean coast reward membership overview 
984382,https://aspirepublicschools.org,1,200,aspir public school aspir public school school focus improv public educ prepar student colleg train highli effect teacher share innov practic aspir public school aspir logo aspir public school school focus improv public educ prepar student colleg train highli effect teacher share innov practic scholar famili resourc discov aspir locat 
449279,https://www.uvbank.net,0,200,root stronger log close login box access account account type bank cash manag log enrol enrol enrol menu extra cautiou respond unsolicit phone call messag purport bank institut extra cautiou respond unsolicit phone call messag purport bank institut learn serv custom fargo street south servic branch come fargo fall avenu 
577131,https://www.seddons.co.uk,0,200,solicitor solicitor solicitor navig commerci real estat bui sell commerci real estat disput hospit leisur leasehold enfranchis auction purchas sale commerci real estat develop commerci real estat sale purchas landlord tenant matter real estat financ corpor disput resolut bank litig commerci real estat disput inherit disput altern disput resolut mediat 
977582,https://www.codac.org,4,200,tucson mental health health recoveri well patient portal navig servic servic integr care philosophi primari care holist well mental behavior health therapi peer mental health residenti treatment transit live substanc treatment fentanyl opioid treatment intens outpati treatment therapi peer transit live class sexual assault advocaci employ servic refer start bill 
583752,https://gazing.com,1,200,gaze sign gazett zone sign gazett gaze coach meet coach athlet organis club school servic organis gaze perform leadership manag sale custom servic confer kick off book custom stori gazett perform zone book custom stori gazett menu perform zone book custom stori gazett feel control perform matter start mindset elit 
971961,https://lakeclarkair.com,6,200,explor southwest alaska explor southwest alaska choos servic lake clark resort farm lodg lodg tour lake clark air airport airport charter flight lake clark resort llc farm lodg 
978913,https://www.carti.com,4,200,cancer focus patient center referr choos mission vision career faq profession educ board director referr locat provid servic servic imag medic oncolog radiat oncolog surgic oncolog intervent radiolog breast gynecolog oncolog dental clinic cancer genet risk manag clinic urolog lymphedema breast cancer rehabilit execut cancer screen packag support palli care 
786,http://www.chess.4mg.com/,3,200,chess studi game sign sign close fast easi close mate mate mate mate plai chess plai chess studi rink horwitz kling cook game karpov alekhin petrosian spasski larsen tournament chess tournament rate rate player chess rule learn rule chess chess link chess site final chess contest prepar worldwid vacat rental 
584127,https://www.gdst.net,1,200,girl school trust girl school trust girl learn limit mission vision valu differ academi trust undivid pastor care chief execut execut leadership truste histori school overview school prep school senior school sixth form head teacher fee pai bursari jargon buster school educ etho insight report framework girl futur report educ 
967600,https://www.bcatoday.org,0,200,council alabama voic alabama busi voic alabama busi leadership board director presid ceo partner advocaci renew alabama advocaci committe capitol brief event event membership membership benefit membership packag payment membership profil resourc overtim tax exempt report guid resourc releas brand resourc capitol brief advoc public worker comp career student internship 
979403,https://www.experiencefayetteville.com,6,200,visit northwest arkansa fayettevil servic calendar menu menu time art cycl dickson street outdoor shop sport motorcycl tag adventur food drink stai calendar guid servic fayettevil art cycl dickson street outdoor shop sport motorcycl tag adventur food drink stai calendar guid servic holidai season light ozark transform histor downtown squar 
462896,https://winddancing.tripod.com,3,200,sign view mail pictur copyright nene thoma pictur fantasi pictur wind danc wind danc born kyra cartwright she daughter merchant brought love brother she experienc town festiv she start ordinarili busier normal afternoon she allow town friend catch festiv afternoon wore crowd rowdier noisier suddenli she assault bear drag nearbi 
973810,https://www.yourgrowingedges.com,4,200,counsel childhood wound trauma depress anxieti arizona grow edg ilyssa counsel psychotherapi counsel philosophi servic therapi depress counsel anxieti grief bereav counsel counsel addict friend famili individu therapi coupl therapi adult wound childhood infertil intens therapi start faith estim appoint request client form rate develop healthi perspect resolv issu feel 
973333,https://www.myfocusonfitness.com,5,200,focu fit person train chandler queen creek phoenix brenda bark toggl navig meet brenda testimoni program price focu fit focu fit custom person fit train effect fit train method train buddi train season boot camp start brenda bark train train focu fit eighteen vallei person train studio other person train 
577287,https://www.wilsongunn.com,0,200,wilson gunn patent trade mark attornei resourc career servic patent trade mark design ip manag ip commercialis ip enforc ip consult sector peopl eng chines servic patent trade mark design ip commercialis ip consult ip enforc ip manag sector peopl resourc career intellectu properti expert servic protect intellectu properti prevent 
574700,https://www.trichology.co.uk,4,200,hair scalp clinic tricholog warrington street ashton hair scalp clinic clinic laser treatment hair condit scalp condit faq legal servic tab navig menu item book consult cut edg invas treatment discov invas procedur design address wide rang hair scalp concern clinic treat manag hair growth scalp rejuven hair health expert 
573264,https://www.leigh-christou.co.uk,0,200,account coventri account leamington spa leigh limit access link access outdat browser upgrad browser outdat browser upgrad browser have troubl view detail tel acct leigh address leigh limit leofric hous road green coventri west midland acct leigh callback menu overview peopl client recruit servic overview audit account forens account litig 
583129,https://www.boarderline.co.uk,5,200,nike burton winter time updat info winter time updat store dai brows collect weekdai requir specialist advic boot fit technic queri product recommend appoint ensur qualifi hand info messag guarante quick respons saturdai sundai store dispatch daili basi fast deliveri login regist basket item pound custom servic skateboard stai social 
972385,https://akcenter.org,1,200,alaska futur alaska donat action action prioriti issu hot take cold board mission vision equiti rational elect endors rep climat clean energi solar program climat care commun seri salmon clean water restor river involv action event volunt opportun akc merch trailsid discoveri camp alaska youth environment action menu power alaska 
967639,https://www.bcbe.org,1,200,baldwin counti public school district select school select school afterschool care baldwin counti school baldwin counti virtual school baldwin preparatori academi baldwin virtual bai minett elementari bai minett middl school elementari school taylor altern program central baldwin middl school daphn east elementari daphn elementari daphn school daphn middl school delta 
494372,https://www.crossword-compiler.com,3,200,crossword compil crossword puzzl maker softwar toggl navig crossword compil window featur faq demo english english deutsch ol fran ai crossword compil vocabulari word puzzl profession crossword power clue theme list gener other puzzl style print publish version puzzl own vocabulari crossword puzzl word search own student learn vocabulari reinforc 
582877,https://ukoutdoorstore.co.uk,5,200,outdoor store outdoor pursuit specialist account regist basket pound product basket return outdoor pursuit specialist depart binocular cloth footwear outdoor knive wood carv whittl outdoor pursuit archeri bird watch camp cycl garden prune knive saw secateur spare hunt shoot swiss armi knive kitchen lock blade pouch prune scissor sharpen spare 
975611,https://royalpalmshotel.com,6,200,luxuri resort scottsdal royal palm resort spa toggl navig resort fee destin galleri histori hyatt career suit villa book experi offer happen health well wed eat drink eat drink cook mix cabana cafe privat dine meet book retreat luxuri resort spa phoenix arizona royal palm resort spa origin spanish coloni 
985195,https://www.chcf.org,4,200,class js class js class js class js california health care foundat health care californian california health care foundat util menu public approach approach goal strategi approach health equiti learn impact prioriti prioriti health equiti univers coverag workforc focu resourc resourc california health care almanac homeless health care health care 
841,http://www.eingang.org/Games/boggle.html,3,200,boggl boggl word find game faq boggl boggl faq faq frequent question document maintain michel hoyl post monthli basi irc game mail list maintain copi game game tabl content boggl game boggl host plai game descript game common encount game game featur control bot command game command channel oper game 
463399,https://huntsmanslodge.com,3,200,menu wrath guid spirit beast guid dp pet hunter enchant hunter gem hunter stat hunter pvp pet raid hunter beast masteri raid hunter marksmanship raid hunter surviv hunter macro wow macro forum gar ui contributor link fantast effort earn brewmast titl satisfi meta achiev earn unlock dwarf hunter fit opinion 
573711,https://www.ritcap.com,0,200,rit capit partner rit capit partner manag rothschild capit manag limit invest rit navig valu cultur histori peopl invest manag board director govern perform invest rit nav commentari rit rit publish nav commentari invest approach invest approach diversifi portfolio quot equiti privat invest uncorrel strategi manag risk studi respons invest 
977508,https://www.advancedchiropracticaz.com,4,200,chiropractor tucson risk request appoint menu meet doctor testimoni review paperwork servic auto injuri relief chiropract chiropract care kid perform enhanc golfer sport injuri relief well care condit spine pain headach migrain neck pain sciatica scoliosi injuri disc injuri whiplash injuri extrem arm leg pain carpal tunnel knee pain neuropathi 
462618,https://muckleshootcasino.com,3,200,casino resort washington casino resort spa book player portal book stai promot promot reward casino host game game overview game machin tabl game limit bet bingo hotel ev book stai resort overview resort special spa hotel resort dine food beverag featur restaur asian restaur smoke cedar market quick servic baja 
967844,https://www.cov.k12.al.us,1,200,login regist navig menu student survei quick link baker avenu andalusia phone fax navig menu cc school board depart superintend financ colleg career child nutrit curriculum counsel guidanc feder program health servic personnel special servic test technolog transport resourc link district intern resourc offic mail board si profession learn set 
583741,https://www.kingfisheraccess.com,1,200,height train cours book here offer cours train centr london essex train centr direct train centr galleri medwai train centr direct har inspect har equip inspect servic tech updat andi access oper road avoid power line toolbox talk reduc trap crush injuri peopl safe vicin power line testimoni jacket request 
574149,https://shireleasing.co.uk,0,200,asset financ equip financ compani shire leas info lock shire login histori vision valu meet affili corpor social respons statement career opportun sme financ charter custom financ growth guarante scheme type solut commerci vehicl financ shire vehicl solut clean air zone financi assist bath bristol manchest newcastl sheffield financ cater 
573291,https://www.hwca.com,0,200,hain watt charter account vat servic advisor challeng account expand sell grow fund start pai tax bui stop flow exit assur account audit process account account payrol tax advisori corpor tax plan intern tax plan person tax plan tax investig tax relief vat custom duti wealth plan privat client advisori 
569442,https://www.forecastsolutions.co.uk,0,200,sale forecast solut demand plan servic servic train softwar forecast solut demand plan servic forecast solut wide rang servic strength build forecast solut excel excel own entiti forecast blend method requir hard afford specialist softwar forecast solut excel base seri forecast method exponenti smooth forecast et causal model estim effect 
978819,https://www.jonesboroschools.net,1,200,jonesboro public school district select school select school jonesboro program jonesboro kindergarten health well environment studi magnet intern studi magnet leadership magnet math scienc magnet visual perform art magnet anni camp junior school dougla macarthur junior school academi jonesboro school northeast arkansa career technic success achiev academi sign district depart 
584194,https://naldic.org.uk,1,200,eal nation subject associ primari navig menu vision mission valu organis structur meet membership choos membership agm agm agm annual report touch eal journal eal journal journal issu digit version summer spring autumn summer spring autumn summer spring autumn summer spring autumn summer spring autumn summer spring autumn summer spring 
573428,https://www.payrollplus.ltd.uk,0,200,payrol payrol process specialist base barnet hertfordshir access link access outdat browser upgrad browser outdat browser upgrad browser have troubl view detail tel address payrol hous mount pleasant barnet hertfordshir type button payrol construct industri scheme process specialist menu overview histori meet payrol solut construct industri scheme solut rti auto 
463087,https://www.sega-16.com,3,200,premier resourc arcad consol hardwar legaci premier resourc arcad consol hardwar legaci review arcad review review master review genesi review review review game gear review saturn review review featur submiss review manifest write media login commun forum discord review arcad review review master review genesi review review review game gear 
1005084,https://www.elitepvpers.com,3,200,plai user password rememb regist account forgot password forum game gold game dedic server merchandis crypto exchang black market game win amaz prize api releas updat function access rest interfac artwork month proudli winner art artwork month proudli winner art photo month proudli winner game commun pass light remark wonder 
463412,https://wowmacros.info,3,200,wow macro warcraft macro wow macro macro command wow script earn extra monei insert navig item here select identifi macro command select class death knight macro demon hunter macro druid macro hunter macro mage macro monk macro paladin macro priest macro rogu macro shaman macro warlock macro warrior macro evok 
584022,https://homeschool.co.uk,1,200,educ menu menu start exampl direct educ remain pursuit method educ individu dim refect own idea optim independ relianc distrust exist system educ desir understand scott project mit categori articl method leav comment god sabbath gift rest israelit earliest civilis establish concept regular rest sabbath religi practic idea sabbath tradition 
449586,https://www.alternatives.org,0,200,altern ithaca ny tompkin counti altern close thanksgiv holidai reopen regular saturdai hour safe enjoi holidai access account bank mobil access mobil lost stolen card atm locat rout altern feder credit union board locat hour atm employ opportun safe disclosur rout wire transfer impact report live wage studi merger account 
977505,https://www.cactusflowerwc.com,4,200,cactu flower chiropract spine pain cactu flower chiropract navig menu dr steven bulletin board locat well librari health chiro articl sublux explain degener nerv chart chiropract slide expert kid chiropract sport chiropract chiropract immun senior chiropract patient servic visit form dr steven chiropract physician tuesdai thursdai appoint glad come miss 
977610,https://www.handsofhopetucson.com,4,200,hand hope tucson pregnanc test servic servic pregnanc ultrasound sti test treatment abort pill revers dad practic counsel abort pregnanc infant loss mend soul deeper resourc locat donat tax credit gala tab navig menu item appoint care famili health pregnant step schedul appoint pregnant commit pregnanc medic region trust pregnanc 
972899,https://sbaaz.org,4,200,spina associ arizona primari navig spina associ arizona build brighter futur impact spina servic program asap plan clinic peer mentor program urinari care suppli babi event mile challeng attend calendar cycl famili fit holidai parti walk roll resourc spina folic acid awar inform link insight spina calendar mission annual report 
573685,https://cherryfinance.co.uk,0,200,cherri financ mortgag mortgag mortgag broker mortgag mortgag seafar mortgag green mortgag jargon buster mortgag mortgag seafar mortgag green mortgag jargon buster mortgag mortgag seafar mortgag green mortgag jargon buster green mortgag green mortgag green mortgag green mortgag green mortgag mortgag experienc aspir landlord mortgag mortgag mortgag mortgag purchas properti 
33281,https://www.cbsl.gov.lk,0,200,central bank sri lanka form english form navig bank overview histori vision mission valu object function organis structur corpor structur princip offic depart bank premis bank headquart region offic librari centr bank studi econom histori museum sri lanka exter report monetari monetari overview econom price stabil monetari framework instrument implement 
582940,https://www.chiltern-archery.co.uk,5,200,chiltern archeri account password rememb regist cart toggl navig bow archeri kit train bow recurv bow riser hoyt win win win win sebastien flute kinet core limb limb exchang limb exchang limb limb limb hoyt limb win win limb limb limb kinet limb core limb bolt limb starter recurv bow 
975138,https://www.mcordova.com,0,200,phoenix person injuri lawyer law offic michael cordova live chat consult practic person injuri car accid truck accid motorcycl accid construct accid defect product dog bite nurs abus pedestrian accid sexual abus slip fall wrong death firm core valu michael noah jodi broaddu kent moffitt premis liabil auto accid wrong 
583305,https://www.bestyears.co.uk,3,200,dinosaur toi knit dinosaur toi rang fb regist cart checkout log eco ethic toi wholesal soft toi come bespok soft toi qualiti wholesal toi chariti faq bespok soft toi dinosaur christma decor nile fair trade wooden rainbow toi wholesal soft toi bespok custom own brand soft toi dinosaur toi dinosaur 
971624,https://beachsidevilla.com,6,200,beachsid villa luxuri suit view avail penthous honeymoon suit harbor view delux grand suit villa king explor menu view avail penthous honeymoon suit harbor view delux grand suit villa king explor book beachsid villa beachsid villa stai juneau prefer suit enjoi amaz view view suit juneau alaska alaska capit citi 
449359,https://www.cbtn.com,0,200,commerci bank footer download acrobat reader view pdf file close alert enter term start locat hour commerci bank menu account login close close login dialog access account account type person bank person bank bank person bank user enrol bank user enrol close menu person check compar account basic check check 
976218,https://www.sonorandentaldesign.com,4,200,sonoran dental design dentist scottsdal locat menu menu menu menu locat transform live comprehens dentistri sonoran dental design dentist scottsdal start consult modern patient focus care comprehens treatment achiev healthi beauti smile led dr ann comprehens care achiev healthi beauti smile amen sedat dentistri virtual painless anesthesia inject visit comfort 
972249,https://www.matsutitle.com,0,200,mat titl agenc llc alaska own oper titl compani primari navig footer mat titl agenc llc alaska own oper titl compani titl properti profil menu titl insur form help link event alaskan own oper titl compani serv mat vallei view rate titl escrow servic properti profil request mst vallei file 
825,http://txshowdown.com/,3,200,premier texa tournament texa showdown premier texa tournament texa showdown game list form volunt form vendor form comment form faq medium locat rule regist care deliber texa showdown hold labor weekend sept hope push safe continu normal registr late registr regist request refund fight game tournament texa return provid intens 
