id,url,label,responseCode,text
448467,https://comedysafedriver.com,1,200,comedi safe driver defens drive tx nm fl question enter toggl navig question enter defens drive texa defens drive mexico traffic school florida driver improv licens yeni flexibl read mobil compat insur discount drive safeti intersect tire pressur safeti drive here sampl video includ bonu comedi break video imag finish 
573717,https://www.7im.co.uk,0,200,invest manag advis privat client invest incom down invest select icon toggl branch financi advis advis client privat client financi advis advis client privat client login fund career press centr fund career press centr origin purpos peopl cleaner invest inclus fund overview fund document perform fund commun career valu current 
978231,https://raftarizona.com,6,200,arizona river runner grand canyon raft ensur enabl purpos access plan choos typic compar trip type bring reserv info help link raft schedul escap escap detail river bar ranch canyon motor motor motor oar trip specialti trip stori choos passeng review guid reserv explor trip reserv reserv grand canyon river 
970710,https://afoc.com,4,200,alaska fractur orthoped clinic surgeon anchorag alaska fractur orthoped clinic patient form patient portal specialti provid physician physician assist physic therapist massag therapist resourc prepar appoint prepar surgeri prescript refil bill locat patient form patient portal specialti provid physician physician assist physic therapist massag therapist resourc prepar appoint prepar surgeri 
451350,https://kohllsrx.com,4,200,rx rx sale rx refil pai sale product servic medic equip bathroom cane walker crutch continu glucos monitor grab bar power lift chair reclin walk tub tub cut respiratori cough assist form nebul servic oxygen tracheostomi ventil mobil equip repair power chair scooter wheelchair power wheelchair wheelchair ramp wheelchair van 
591037,https://themereresort.co.uk,5,200,cheshir premier golf spa resort extremeli outdat browser upgrad browser spa golf wed dine gift voucher offer mere christma book menu short break golf corpor golf societi golf membership golf membership login fixtur list competit book spa health spa treatment health club membership dine restaur spa loung bar gift voucher 
463057,https://www.pcgamer.com,3,200,pc gamer menu close menu pc gamer pc gamer global author pc game pc gamer subscrib edit canada australia game hardwar industri review forum pc game softwar movi coupon magazin commun guidelin affili link meet pc gamer pc gamer magazin subscript subscrib subscrib pc game mag singl save subscript issu 
261,https://www.sportsmanagement.co.uk/index.cfm,5,200,sport job sport sport featur sport manag magazin sport job sport sport featur sport interview global sport industri sport magazin sport job sport sport featur sport industri interview england physic activ coronaviru fit gym stadium edward leisur centr exercis pandem swim premier leagu cycl sport manag hous lord committe scrutinis 
976447,https://www.sedonareal.com,6,200,sedona inn suit offici rate guarante sedona inn suit book stai overview pet friendli famili suit special overview properti event galleri embrac spirit sedona real inn suit adventur awaken sens invigor spirit red rock butt steep canyon vibrant uptown beckon explor even perfect bond stai sedona real inn suit offer 
985189,https://coalitionccc.org,4,200,sign membership donat cart toggl navig toggl keyword keyword previou advocaci organ laser focus ill care provid patient public monitor legisl expert advic regul advoc feder lawmak learn membership coalit compassion care california statewid collabor commun individu organ promot qualiti compassion care californian approach store brows qualiti expert develop tool 
977603,https://eyestucson.com,4,200,ey doctor optometrist tucson appoint here bakewel maltzman hunter associ oracl ey physician surgeon provid excel ey care matter servic cataract cataract surgeri refract surgeri ey surgeri refract len exchang rle keratectomi glaucoma manag clinic optometri ophthalmolog emerg ey care optic ey glass lens doctor jeff maltzman fac brian hunter 
968279,https://www.birminghambusinessalliance.com,0,200,birmingham allianc directori login menu leadership bba foundat event calendar signatur event submit investor involv sponsorship econom develop locat expand talent workforc develop target industri incent overview connect expert supplier scale inclus procur council advocaci intern trade program birmingham allianc bba local chamber commerc citi birmingham econom develop agenc birmingham 
967817,https://www.pcboe.net,1,200,phenix citi school district select school select school central freshman academi south girard phenix citi intermedi lakewood elementari lakewood primari elementari phenix citi elementari ridgecrest elementari sherwood elementari elementari sign school district bid report polici board educ directori depart commun educ employe benefit administr oper child nutrit commun feder program 
583965,https://www.oysterworldwide.com,1,200,gap travel gap program volunt gap respons travel specialist toll oyster project destin travel oyster adventur gap career break respons travel week countri project project adventur travel summer trip tour volunt holidai trip volunt anim environment conserv marin conserv programm veterinari volunt eleph hospit paid academ credit diploma conserv career 
970198,https://www.yupiit.org,1,200,school district navig option select school school district akiachak school akiak school school languag view origin spanish cantones french german italian tagalog vietnames korean russian hindi login guest school district box akiachak ak phone fax loc menu alumni spotlight newslett archiv thunderbolt crack rank assist checkpoint congrat graduat updat district 
978912,https://arpapsych.org,4,200,arkansa psycholog associ event membership expand membership step membership renew donat profession develop expand arkansa licensur train opportun arkansa divers student connect award event modern project resourc expand media librari commun info arkansa psycholog healthi workplac award log toggl menu advanc psycholog career unlock opportun profession growth connect network mind 
1423,https://www.porn300.com,2,200,porn video porn start here porn regist login upload menu straight gai start here porn categori pornstar tag channel live sex sex lithuania trend mom son mom sleep cheat schoolgirl gai brother sister hard sex dad daughter public teen famili sex matur caught vintag lana rhoad danger mia khalifa rilei 
462873,https://www.rpgfix.com,3,200,role plai game directori login commun commun post brows game brows game brows categori defunct site submit tag resourc resourc activ author review code conduct trophi patron account notabl current visitor activ faq faq commun directori discord vote chat chat menu role plai game directori brows game browser displai other 
967843,https://www.crenshaw-schools.org,1,200,crenshaw counti school district select school select school brantlei school highland school luvern school sign translat social media submit crenshaw counti school excel innov inspir motiv district mission vision superintend account report directori depart board educ career tech child nutrit curriculum instruct assess feder program financ mainten transport special educ 
978911,https://psychologyboard.arkansas.gov,4,200,psycholog board licens verif renew license applic renew mobil public law rule select arkansa psycholog board notic notic public comment period pursuant arkansa code annot seq notic arkansa psycholog board board propos revis rule propos revis modif rule includ limit subject issu relicens psycholog examin amend arkansa occup licens uniform 
973903,https://www.myrickscabins.com,6,200,myrick cabin greer arizona cabin rental cabin lamar shoshon teton reserv locat locat map drive direct photo detail cabin lamar shoshon teton div minut christma reserv rent real log cabin greer arizona enjoi vacat terrif view privat acr border nation forest land beauti greer arizona shoshon teton lamar superb log 
573318,https://numerion.co.uk,0,200,charter account london associ protect broad street london overview testimoni submit testimoni request consult registr servic account intern start bookkeep cloud account fd cfo servic payrol person taxat studi overview citi solut north star underwrit menu overview testimoni submit testimoni request consult registr servic account intern start bookkeep cloud account 
568675,https://www.retailconcessions.co.uk,0,200,retail concess bull retail concess consum lead cater trailer commercialis retail concess sell retail floor space type promot space instor concess mobil cater site car park town centr landlord manag agent retail industri type sale cater social instor concess mobil cater site car park town centr landlord manag agent retail 
462856,https://www.speedcubing.com,3,200,cube databas resourc event beginn list advanc cube tutori tutori other guid start learn specif step method choic commun forum server cuber meet discuss learn each other reconstruct scrambl move offici unoffici class solv fastest cuber softwar trainer cube softwar timer trainer other journei faster time record comp offici unoffici 
291,https://www.yoursoccerdose.com/,5,200,footbal soccer highlight bring footbal soccer highlight statist video major footbal leagu intern comp european giant reignit sort alli final decis speak futur retir summer readi extend psg condit manchest citi react controversi porto popular competit premier leagu champion leagu ml popular premier ucl competit premier leagu champion leagu ml 
820,http://home.hiwaay.net/~lkseitz/cvg/nexus/,3,200,classic game nexu regret inform classic game nexu nexu short regular updat ceas offici close final start enforc disk space limit decid sacrific nexu safeti buffer space completeli luck nexu exist internet archiv nexu internet archiv classic game commun hope remain touch game creat lee seitz mail 
973693,https://gilbertserenitydental.com,4,200,dentist gilbert seren dental offic servic testimoni form menu offic servic testimoni form jai bhatt dd jai bhatt dd jai bhatt dd jai bhatt dd jai bhatt dd practic dr jai bhatt extens cosmet dentistri techniqu help hundr patient achiev smile dream care creat smile suit lifetim offic servic patient 
971319,https://glacierbayalaska.com,6,200,glacier bai countri inn gustavu alaska lodg glacier bai hotel hit enter esc close close menu alaska fish fish fish packag saltwat fish freshwat fish fish speci guid adventur saltwat fish trip fresh water fish trip glacier bai nation park whale watch tour kayak wilder isl kayak kayak whale mcbride 
1413,https://www.porn.com,2,200,porn video hd vr sex video porn porn tube straight straight gai transgend english deutsch ol fran ai nederland categori pornstar porn site porn game meet fuck live sex premium porn trend unit stepsist mom threesom black japanes monster cock stepdaught lesbian babysitt stepson anal teen granni gangbang ass homemad 
584178,https://instructor-training.co.uk,1,200,instructor train public train drive instructor secondari navig footer basket train drive instructor save collect book pic public coach essenti comprehens book explain coach involv practic class view book adi train trainer account basket motorwai drive essenti brian stratton class view book drive essenti brian stratton class view book drive 
584211,https://www.equalityanddiversity.co.uk,1,200,equal divers train resourc equal network pattern pattern background pattern box layout mode dark dark header version train bull resourc bull network toggl navig hous train train resourc network black histori month equal divers train bull resourc bull network short tactic strateg assist organis implement equal divers practic servic includ 
985181,https://crihb.org,4,200,california rural indian health board menu board director tribal health program accomplish career posit public health updat program prevent educ dental transform initi domest violenc prevent initi health well acorn injuri prevent opioid respons project public health updat suicid prevent tobacco cancer children youth child care develop fund program tribal 
584176,https://www.eurotrainingservices.co.uk,1,200,forklift train cours kent excav plant oper train cours testimoni menu train cours cours counterbal forklift truck reach truck diesel electr ga load forklift truck rough terrain mast forklift truck electr pallet truck excav backho bucket excav oper track wheel skid steer loader bob cat load shovel track wheel attach 
448486,https://sts-firstaid.co.uk,1,200,st aid info st locat cours book select download train timet download aid safeti train trust biggest compani meet aid safeti train bring aid safeti train aid safeti train deliv hundr cours each here aid safeti train compani passionateli empow client essenti aid skill ensur prepar situat aid emerg aid 
584212,https://www.cmeprojects.com,1,200,project steve mill hilari steve mill hilari expert mathemat educ internation consult award win author seek promot enthusiasm mathemat strive peopl understand enjoi subject extens rang math educ have taught level post graduat servic train teacher steve hilari written mathemat book teacher parent children develop softwar materi internet steve mill 
821,http://members.tripod.com/~hamishf/,3,200,hamish arcad cabinet project boom box wtf arcad cabinet confus surli crap lunat boost ego arcad cabinet comparison fine special hunk doo cabinet card steel rotat frame monitor huge mission pictur technolog marvel leav leav pure beauti harsh spell knowledg english languag boom box arcad cabinet project statu form imaginari 
584086,https://www.tts-group.co.uk,1,200,tt school suppli primari secondari tt school resourc account login regist account login regist account view art craft view art craft adhes brush applic chalkboard collag craft draw dry rack easel mark model paint paint pot trai paper displai resourc storag rang babi toddler view babi toddler black white resourc 
972022,https://www.breezeinn.com,6,200,seward alaska hotel breez inn seward alaska hotel book north harbor drive bull seward alaska bull packag photo review wyndham garden york accommod special photo galleri review amen dine guid event calendar meet career direct choic seward alaska hotel relax getawai seward alaska breez inn offer fulfil lodg breathtak set 
583859,https://www.chdt.co.uk,1,200,chiltern develop train karena item minibu driver train minibu driver train school buck counti council driver minibu complianc school permit faq fleet driver train fleet driver assess programm mida pat mida minibu driver assess scheme passeng assist train scheme pat mot cours select chiltern develop train built reput deliv qualiti 
807,http://www.atlas-games.com/onceuponatime/,3,200,atla game game ag player card stori finish tale satisfi win game storytel game card game core expans writer handbook enchant tale seafar tale knightli tale anim tale fairi tale creat storytel card game glanc trip trap bridg beauti damsel fantast sight award resourc download extern link translat magic kitti 
582913,https://www.sportstrophy.co.uk,5,200,sport trophi medal sheffield sport trophi hide hide sport trophi detail login sport trophi american footbal trophi archeri trophi athlet trophi badminton trophi basketbal trophi box trophi cricket trophi cycl trophi danc trophi dart trophi equestrian trophi fish trophi footbal trophi golf trophi gymnast trophi hockei trophi ic hockei trophi 
573360,https://www.sterlings.co.uk,0,200,here sterl will probat here sterl will probat servic account audit bookkeep account start compani secretari corpor financ corpor tax plan vat payrol person account estat plan person tax plan retir plan assess trust specialist sector sign login resourc account account account account account tax resourc resourc vital tool assess 
791,http://www.pagat.com/rummy/handfoot.html,3,200,hand foot card game rule plai hand foot canasta american game player hand card foot pick card hand plai hand foot introduct partnership hand foot player player card deal object game meld card bonu minimum initi meld requir plai pick foot red black plai advic tactic variat wild card red 
573598,https://www.creditserve.co.uk,0,200,credit refer agenc compani credit report menu login credit check bronz packag silver packag gold packag anti monei launder search search pack search pack search pack intern credit check french compani credit check german compani credit check italian compani credit check belgian compani credit check spanish compani credit check irish 
462451,https://6mm-minis.blogspot.com,3,200,mini mini mini discuss game miniatur book movi food israel judaism other funni crud favorit scale miniatur call scale enjoi kind game ancient wwi wwii arab israeli conflict car war aka sort crash derbi automobil combat game aka game scienc fiction game wednesdai mini samurai bench post happen bui hous 
970107,https://www.asrc.com,0,200,arctic slope region corpor arctic slope region corpor slim nav hamburg toggler nav fix nav scroll light nav dark overview histori commun land job oper overview govern contract servic petroleum refin market energi servic industri servic land natur resourc construct other busi leadership resourc corpor sharehold alaska nativ corpor establish 
815,http://www.arcadebelgium.be/,3,200,arcad belgium song ster tour releas spring demon label releas arcadia label bunni bomber blast announc arcadia arcadia wild gun rawhid announc arcadia dragon ball super diver super ufo fighter announc winter squad featur samurai pizza cat pre start dragon ball super diver dragon ball super diver digit card game 
800,http://www.pagat.com/patience/,3,200,card game competit patienc competit patienc card game competit patienc game card game layout plai solitair player classifi card game competit patienc classifi layout competit patienc game type layout player solitair patienc game card add respect rule plai multi player solitair game consist peopl plai player solitair simultaneousli winner game 
573806,https://brasil.co.uk,0,200,brasil brasil divis financi risk financi institut execut profession risk polit risk trade credit sureti transport marin aviat cargo liabil accid health energi construct energi construct compani info directori oversea divis financi risk financi institut execut profession risk polit risk trade credit sureti transport marin aviat cargo liabil accid health 
584020,https://www.ujs.org.uk,1,200,union jewish student peopl support public confer school campu campu univers univers accommod univers mental health univers network univers safeti secur univers financ univers soc committe hub career hub career hub job opportun student sport project campu digit israel portal event event event checklist event access checklist donat donat annual 
574822,https://platformliftco.co.uk,4,200,platform lift compani lead independ platform lift supplier instal process regul commerci lift cabin style platform lift vertic platform lift style platform lift hidden platform lift residenti lift vertic lift style platform lift stair riser lift servic mainten project trade process regul commerci lift cabin style platform lift vertic platform 
573872,https://www.wrightsure.com,0,200,insur haulag coach oper liabil theatr perform insur info travel insur queri claim risk manag product commun transport logist passeng transport insur motor trade liabil perform liabil report claim premium payment download download librari accid report form liabil form breakdown recoveri form perform form essex liverpool hampshir lincoln leed account 
979666,https://mountainthyme.com,6,200,mountain thyme bed breakfast inn hot spring menu book check avail book hot spring bed breakfast retreat absoluteli book rate food packag direct info review photo magic mountain thyme walk wood scenic drive mountain sit porch swing enjoi even spend hot spring nation park tour scenic bywai park hike swim 
1418,https://pornhubs.video,2,200,porno xxx porn hub movi pornstar categori biggest tube earth left plain effortless love assort gonzo enabl observ nich cost step mother stepsist india desi innoc natur hard fuck queen woman masturb punish sex threesom extrem brother tit indian girl cutest thai school vibrat sister teen escort pain stori kristof 
976441,https://www.almadesedona.com,6,200,scenic sedona bed breakfast inn alma sedona del sol athena mari desert dream nativ spirit romant reflect journei settler pine casa blanca pavilion photo info sedona adventur grand canyon park monument jerom horseback ride wineri restaur verd canyon railroad sedona intern film festiv hummingbird festiv golf spiritu breakfast polici addit 
263,https://sportgrill.blog/,5,200,sport grill sport grill guid late footbal action sky bet championship tuesdai premier leagu manchest citi west brom premier leagu wolf chelsea manchest unit tough europa leagu chelsea liverpool manchest citi discov opposit premier leagu roundup max domin abu dhabi victori premier leagu leicest brighton premier leagu arsen burnlei sky 
573467,https://www.barclays.co.uk,0,200,person bank footer person close menu premier wealth manag corpor privat bank intern bank close login menu digit bank digit bank bank bank bank locat local bank branch bank hub bank post offic bank telephon bank bank safe bank digit confid control data digit eagl creat iban switch bank account 
970110,https://www.mtasolutions.com,0,200,alaska internet provid residenti mta alaska residenti fairbank enterpris wholesal foundat pai portal internet phone event internet phone event login pai portal enterpris wholesal foundat previou educ unlimit internet discount unlimit knowledg deserv unlimit internet learn local technolog leader creat meaning solut empow owner live connect live construct updat explor 
970897,https://alaskatrips.com,6,200,alaskan tour travel adventur privat guid wilkinson expedit ken custom trip ken bio testimoni alaska winter tour summer tour alaska trip plan alaska photo safari select ken wilkinson alaskan privat guid tour beaten path explor ken custom special adventur tour bring alaskan wild few bear view glacier hike whale watch 
973689,https://gilbertcenterdentistry.com,4,200,gilbert dentistri dr joshua haslam dentistri gilbert lindsai gilbert tel request appoint servic famili dentistri cosmet dentistri prevent dentistri restor dentistri dentistri children technolog patient faq testimoni navig servic famili dentistri cosmet dentistri prevent dentistri restor dentistri dentistri children technolog patient faq testimoni smile await gilbert dentistri consist profession dental 
573385,https://dre.co.uk,0,200,account shrewsburi ludlow wrexham navig meet promis frequent question servic audit account payrol manag financi servic tax complianc resourc practic tax tip vacanc client growth sign login independ firm charter account establish offic shrewsburi ludlow wrexham knighton partner director experienc qualifi provid rang profession servic individu partnership compani chariti trust 
584061,https://www.lajolieronde.co.uk,1,200,joli rond french spanish class club resourc school nurseri parent parent guid visit media player class joli rond award win provid french spanish languag learn children deliv lunchtim class school club extra curricular class suppli languag resourc primari school academi prep school local class award win class award win class 
595182,https://low-hall.co.uk,6,200,hall farm hall farm hall estat acr beef sheep farm peac countrysid enjoi panoram view south lakeland fell estuari hall slate gravel track excel access weather tracei edmondson kirkbi fur cumbria england map here pitch hard stand water tap pitch modern central heat shower block washroom each washbasin toilet shower 
809,http://www.portmacquariebridge.websyte.com.au/,3,200,port panther bridg club port panther bridg club programm login password presid wayn willi vice presid bob secretari annett davi treasur stephen goldstein bridg plai wednesdai panther club bai street port seat visitor requir partner denis franklin panther bridg club associ inform current measur feder govern regard corona viru request 
583858,https://www.dgtrain.co.uk,1,200,train cours danger train iata cpc train cours train danger specialist chem train cours initi driver train cours regul initi explos cours certif profession compet cpc driver cpc train train explos awar iata train cours train manual handl movement danger workplac transport safeli secur danger orang book train driver other 
573842,https://piibrokers.co.uk,0,200,broker profession indemn insur broker broker profession indemn insur broker profession indemn insur broker sme claim testimoni instant quot advic profession indemn insur broke broker advis arrang profession indemn other insur product repres client major profess busi servic client receiv broker servic tailor polici meet coverag requir addit provid guidanc 
587286,https://www.lifecycle.org.uk,5,200,cycl bristol base cycl chariti store cooki click accept agre store cooki devic enhanc navig analys usag assist market effort view accept manag prefer visit store retriev data browser storag basic function storag market analyt personalis store prefer option disabl type storag basic function block categori impact manag consent prefer 
970907,https://alaskatours.com,6,200,alaska tour alaska vacat travel trip land tour packag info navig visitor alaska time visit alaska type travel travel alaska travel alaska interact alaska alaska travel distanc travel weather alaska frequent question stori alaska brows stori travel tip wildlif alaska epic locat lifestyl local nativ cultur histori trivia choos alaska 
